{
  "$schema": "./schemas/roadmap.schema.json",
  "archive_policy": {
    "active_document": "ROADMAP.json",
    "historical_directory": "docs/archive/roadmaps",
    "historical_format": "markdown",
    "snapshots": []
  },
  "baseline": [
    {
      "id": "baseline.cli-entrypoint-exists",
      "status": "done",
      "title": "The repository already contains a standalone CLI entrypoint and interactive TUI loop in src/parun.nim."
    },
    {
      "id": "baseline.soa-package-model-exists",
      "status": "done",
      "title": "Package search data already uses a hot/cold SoA layout through PackageSOA, PackageHot, and PackageCold."
    },
    {
      "id": "baseline.binary-cache-exists",
      "status": "done",
      "title": "AUR and Nimble metadata already have an on-disk binary cache path and a memory-mapped reader in src/pkgs/cache.nim."
    },
    {
      "id": "baseline.instant-switch-semantics-exist",
      "status": "done",
      "title": "The current product contract already includes instant source switching through aur/, nim/, nimble/, and installed/ search prefixes."
    }
  ],
  "current_focus": {
    "phase_id": "phase-2",
    "task_ids": [
      "phase-2.query-primitives"
    ],
    "why": "The roadmap is complete; focus is anchored on the non-terminal query-primitives task that feeds the finished indexed runtime."
  },
  "execution_order": [
    "phase-1",
    "phase-2",
    "phase-3",
    "phase-4"
  ],
  "id": "parun-active-roadmap",
  "mission": "Make parun an instant multi-source package search TUI with parui-class idle memory by replacing heap-resident package state with validated, low-residency indexed storage while preserving zero visible latency for source switching.",
  "phases": [
    {
      "exit_criteria": [
        "The repository can reproduce current memory and latency baselines on demand.",
        "The dominant owners of current Private_Dirty are measured and ranked.",
        "The Nim ownership contract for future indexed storage is explicit enough to constrain the next architecture phase."
      ],
      "goal": "Produce a repeatable memory and latency baseline, plus a precise accounting of which runtime structures currently own the app's heap footprint.",
      "id": "phase-1",
      "priority": "p0",
      "status": "done",
      "tasks": [
        {
          "acceptance_criteria": [
            "One documented command produces baseline measurements for idle RSS, idle PSS, idle Private_Dirty, and source-switch timing on a release build.",
            "The harness measures the real parun process rather than a wrapper shell and records the exact executable path and pid it sampled.",
            "The measurement flow supports at least idle startup and a scripted first aur/ switch without requiring manual keystrokes."
          ],
          "depends_on": [],
          "evidence_required": [
            "Harness command",
            "Captured baseline output artifact",
            "Recorded measurement environment including Nim version and build mode"
          ],
          "files": [
            "parun.nimble",
            "tools/",
            "src/parun.nim"
          ],
          "id": "phase-1.measurement-harness",
          "kind": "validation",
          "priority": "p0",
          "status": "done",
          "summary": "Create a repo-local harness that builds parun in release mode, launches the real TUI under a controlled PTY, captures idle and post-switch memory from procfs, and records first-switch latency for local, AUR, and Nimble workloads.",
          "title": "Add repeatable release-build measurement harness"
        },
        {
          "acceptance_criteria": [
            "The report distinguishes top-level object size from dynamically owned bytes in seq, string, and table-backed structures.",
            "The report identifies the dominant contributors to current Private_Dirty for system, AUR, and Nimble data separately.",
            "The report is generated without requiring the interactive UI loop to be driven manually."
          ],
          "depends_on": [
            "phase-1.measurement-harness"
          ],
          "evidence_required": [
            "Machine-readable byte-accounting report",
            "Human-readable summary of top memory owners",
            "Exact load scenario used to produce the report"
          ],
          "files": [
            "src/core/types.nim",
            "src/core/state.nim",
            "src/core/systems/update_system.nim",
            "src/pkgs/manager.nim",
            "src/pkgs/worker.nim",
            "src/pkgs/cache.nim",
            "tools/"
          ],
          "id": "phase-1.byte-accounting",
          "kind": "research",
          "priority": "p0",
          "status": "done",
          "summary": "Add a non-interactive diagnostics path that loads the same package data as the app and reports compile-time sizes plus runtime reserved bytes for AppState, PackageDB instances, arenas, result buffers, repo tables, details caches, and worker-side caches.",
          "title": "Attribute heap ownership across AppState and worker structures"
        },
        {
          "acceptance_criteria": [
            "The roadmap slice records the selected Nim memory-manager assumptions and how diagnostics are compiled and run.",
            "The codebase contains a single diagnostic-oriented place where mapped-data access rules and permitted copy boundaries are defined.",
            "The contract names which existing string-producing helpers cannot remain on the future hot path without redesign."
          ],
          "depends_on": [
            "phase-1.byte-accounting"
          ],
          "evidence_required": [
            "Documented ownership contract",
            "Referenced code locations for allowed and forbidden copy boundaries"
          ],
          "files": [
            "ROADMAP.json",
            "src/core/state.nim",
            "src/pkgs/cache.nim",
            "src/ui/renderer.nim",
            "tools/"
          ],
          "id": "phase-1.ownership-contract",
          "kind": "contract",
          "priority": "p1",
          "status": "done",
          "summary": "Document and enforce the ARC/ORC rules for future mmap-backed indexes so hot-path readers do not accidentally promote mapped slices into heap strings or widen mutable ownership beyond what the low-RAM design allows.",
          "title": "Make the Nim ownership and borrowing contract explicit for indexed data"
        }
      ],
      "title": "Establish Measured Baselines"
    },
    {
      "exit_criteria": [
        "Each source has a defined immutable index format and deterministic builder.",
        "The hot search primitive is selected with explicit memory and latency evidence.",
        "The architecture is ready to replace heap-resident package databases without losing search coverage."
      ],
      "goal": "Replace heap-resident package corpora with immutable, file-backed source indexes whose hot access patterns are explicit and measurable.",
      "id": "phase-2",
      "priority": "p0",
      "status": "done",
      "tasks": [
        {
          "acceptance_criteria": [
            "The index format names every section needed by the hot search path and every section reserved for cold details.",
            "The format includes versioning and validation rules strong enough to reject corrupt or stale indexes.",
            "The format makes explicit which sections may be prefaulted or madvise'd without forcing full-corpus residency."
          ],
          "depends_on": [
            "phase-1.byte-accounting",
            "phase-1.ownership-contract"
          ],
          "evidence_required": [
            "Index format document or schema",
            "Validation invariants",
            "Byte budget per section"
          ],
          "files": [
            "src/pkgs/cache.nim",
            "src/core/types.nim",
            "docs/"
          ],
          "id": "phase-2.index-layout-spec",
          "kind": "architecture",
          "priority": "p0",
          "status": "done",
          "summary": "Define the file layout, headers, section offsets, versioning, and invariants for local, AUR, and Nimble indexes so names, normalized keys, posting lists, and cold details can be addressed without heap reconstruction.",
          "title": "Specify the binary layout for immutable source indexes"
        },
        {
          "acceptance_criteria": [
            "The builder produces reproducible indexes for each source from the same input snapshot.",
            "Generated indexes include integrity metadata that can be checked before runtime mapping.",
            "Builder output preserves the package count and visible search corpus of the current caches."
          ],
          "depends_on": [
            "phase-2.index-layout-spec"
          ],
          "evidence_required": [
            "Builder command",
            "Generated sample indexes",
            "Integrity verification output"
          ],
          "files": [
            "src/pkgs/cache.nim",
            "src/pkgs/backends/pacman.nim",
            "src/pkgs/backends/nimble.nim",
            "tools/"
          ],
          "id": "phase-2.index-builder",
          "kind": "implementation",
          "priority": "p0",
          "status": "done",
          "summary": "Build offline index-generation tooling that converts current package metadata into immutable source indexes with deterministic output and integrity checks.",
          "title": "Implement deterministic index builders for system, AUR, and Nimble"
        },
        {
          "acceptance_criteria": [
            "The chosen primitive set has a measured byte budget and a documented reason it fits the instant-switch requirement.",
            "Candidate narrowing avoids materializing full-name strings on the heap for ordinary typing paths.",